{
  "recordId": "gate2a-p-design-review-pending",
  "contractVersion": "0.13.0-draft",
  "recordKind": "design-review",
  "reviewedArtifactPath": "auditors/problem-evidence/gate2a/manifest.json",
  "reviewedArtifactVersion": "0.2.0-draft",
  "reviewedArtifactDigest": "8f2dff8d2a564b3bf654d212d69610275e0a3677661bc6e528f3280a3e18a924",
  "digestAlgorithm": "json.dumps-sort-keys-compact-sha256",
  "reviewStatus": "pending-owner-review",
  "humanReviewOccurred": false,
  "designApproved": false,
  "reviewerRepresentation": null,
  "reviewTimestamp": null,
  "scopeOfDecision": "Illustrative example of the external review-record shape. No review has occurred. The record references the package manifest and its digest and is excluded from that digest, so updating the record never mutates the reviewed content.",
  "doesNotEstablish": [
    "Authenticated reviewer identity",
    "Tamper-proof detached authority",
    "Operational comparator permission",
    "Runtime-enforcement permission",
    "Model compatibility approval",
    "Gate 2A-P or Gate 2A completion",
    "Formal Phase 1 acceptance"
  ]
}
